{
  "$schema": "https://json-schema.org/draft/2020-12/schema",
  "$id": "report_company.schema.json",
  "title": "CompanyReportV2",
  "type": "object",
  "additionalProperties": false,
  "required": [
    "version",
    "kind",
    "run_id",
    "generated_at",
    "subject",
    "plan",
    "sources",
    "numeric_facts",
    "sections",
    "exhibits",
    "appendix"
  ],
  "properties": {
    "version": { "type": "integer", "const": 2 },
    "kind": { "type": "string", "const": "company" },
    "run_id": { "type": "string", "minLength": 6 },
    "generated_at": {
      "type": "string",
      "pattern": "^\\d{4}-\\d{2}-\\d{2}T\\d{2}:\\d{2}:\\d{2}(?:\\.\\d{1,3})?(?:Z|[+-]\\d{2}:\\d{2})$"
    },
    "subject": {
      "type": "object",
      "additionalProperties": false,
      "required": ["ticker"],
      "properties": {
        "ticker": { "type": "string", "pattern": "^[A-Z0-9.]{1,10}$" },
        "company_name": { "type": "string" }
      }
    },
    "plan": {
      "type": "object",
      "additionalProperties": false,
      "required": ["posture", "horizon", "timebox_minutes", "key_questions", "required_exhibits"],
      "properties": {
        "posture": { "type": "string", "enum": ["long-only"] },
        "horizon": { "type": "string", "minLength": 1 },
        "timebox_minutes": { "type": "integer", "minimum": 1, "maximum": 600 },
        "key_questions": {
          "type": "array",
          "minItems": 1,
          "items": { "type": "string", "minLength": 1 }
        },
        "required_exhibits": {
          "type": "array",
          "minItems": 1,
          "items": { "type": "string", "minLength": 1 }
        }
      }
    },
    "sources": {
      "type": "array",
      "minItems": 1,
      "items": { "$ref": "evidence_item.schema.json" }
    },
    "numeric_facts": {
      "type": "array",
      "items": {
        "type": "object",
        "additionalProperties": false,
        "required": ["id", "value", "unit", "period", "source_id", "accessed_at"],
        "properties": {
          "id": { "type": "string", "pattern": "^N\\d+$" },
          "value": { "type": "number" },
          "unit": { "type": "string", "minLength": 1 },
          "period": { "type": "string", "minLength": 1 },
          "currency": { "type": "string", "minLength": 1 },
          "source_id": { "type": "string", "pattern": "^S\\d+$" },
          "accessed_at": {
            "type": "string",
            "pattern": "^\\d{4}-\\d{2}-\\d{2}T\\d{2}:\\d{2}:\\d{2}(?:\\.\\d{1,3})?(?:Z|[+-]\\d{2}:\\d{2})$"
          },
          "notes": { "type": "string" }
        }
      }
    },
    "sections": {
      "type": "array",
      "minItems": 6,
      "items": {
        "type": "object",
        "additionalProperties": false,
        "required": ["key", "title", "blocks"],
        "properties": {
          "key": {
            "type": "string",
            "enum": [
              "executive_summary",
              "variant_perception",
              "thesis",
              "business_overview",
              "moat_competition",
              "financial_quality",
              "valuation_scenarios",
              "catalysts",
              "risks_premortem",
              "change_mind_triggers"
            ]
          },
          "title": { "type": "string", "minLength": 1 },
          "na_reason": { "type": "string" },
          "blocks": {
            "type": "array",
            "minItems": 1,
            "items": {
              "type": "object",
              "additionalProperties": false,
              "required": ["tag", "text"],
              "properties": {
                "tag": { "type": "string", "enum": ["FACT", "INTERPRETATION", "ASSUMPTION"] },
                "text": { "type": "string", "minLength": 1 },
                "source_ids": {
                  "type": "array",
                  "items": { "type": "string", "pattern": "^S\\d+$" }
                },
                "numeric_refs": {
                  "type": "array",
                  "items": { "type": "string", "pattern": "^N\\d+$" }
                }
              }
            }
          }
        }
      }
    },
    "exhibits": {
      "type": "array",
      "minItems": 1,
      "items": { "$ref": "exhibit.schema.json" }
    },
    "appendix": {
      "type": "object",
      "additionalProperties": false,
      "required": ["evidence_table", "whats_missing"],
      "properties": {
        "evidence_table": {
          "type": "array",
          "minItems": 1,
          "items": {
            "type": "object",
            "additionalProperties": false,
            "required": ["claim", "evidence_ids", "source_ids"],
            "properties": {
              "claim": { "type": "string", "minLength": 1 },
              "evidence_ids": {
                "type": "array",
                "minItems": 1,
                "items": { "type": "string", "pattern": "^S\\d+$" }
              },
              "source_ids": {
                "type": "array",
                "minItems": 1,
                "items": { "type": "string", "pattern": "^S\\d+$" }
              }
            }
          }
        },
        "whats_missing": {
          "type": "array",
          "items": { "type": "string" }
        }
      }
    }
  }
}
